#;Identificador;Pergunta;Opcoesrespostas;Resposta Correta;Resposta OpenEvidence;Link OpenEvidence;Explicacao OpenEvidence;Referências
222;Question 24.1 (MC-NJ) - Step 3;"An 88-year-old man with osteoarthritis is brought to the office by his daughter because of a 2-day history of severe low back pain and inability to walk. He says he has not fallen and does not recall any trauma to his back. Five years ago, he underwent bilateral hip replacement. His pain and mobility improved following the operation but have worsened during the past year. He now is most comfortable using a wheelchair for ambulation but is able to ambulate for short distances with a walker and assistance. One year ago, carcinoma of the prostate was diagnosed, but he declined therapy and said, ""I'm an old man. When my time comes, I want to die. Just keep me as comfortable as you can."" Vital signs today are temperature 36.6°C (97.9°F), pulse 88/min, respirations 16/min, and blood pressure 188/66 mm Hg. The patient is grimacing with pain and holding his lower back. Palpation discloses point tenderness over L3 through L4, and S1. X-rays of the lumbosacral spine show lytic lesions and compression fracture. The patient refuses additional diagnostic studies. The daughter fears that her father will be ""abandoned"" if he is not evaluated for additional treatment. Which of the following is the most appropriate next step in response to the daughter's concern?";(A) Explain the daughter's concerns to the patient and persuasively present the advantages of further evaluation (B) Explain to the daughter that no significant treatment will result from further testing and recommend having a home health nurse (C) Obtain consultation with an oncologist to assess the patient's need for further testing (D) Reassure the daughter and recommend hospice care consultation (E) Reassure the daughter and recommend transfer of the patient to an assisted living facility;D;D;https://openevidence.com/usmle-results/step-3-;"The most appropriate next step is to reassure the daughter that her father will not be abandoned and to recommend hospice care consultation, as this aligns with the patient's wishes for comfort-focused care, addresses the family's emotional concerns, and ensures ongoing comprehensive support for both patient and family.[1][2][3][4] Rationale: • The patient is a competent adult refusing further diagnostic evaluation; honoring an informed refusal while continuing care is ethically appropriate and respects autonomy. Persuasion may be offered without coercion, but he has already refused; shifting focus to comfort is reasonable given likely metastatic disease with pathologic fracture and functional decline.[1][5][6] • The daughter’s fear of “abandonment” should be directly acknowledged and reframed toward positive goals (comfort, support), clarifying that hospice increases—not withdraws—care and provides interdisciplinary symptom management, psychosocial/spiritual support, and caregiver assistance.[2] [3][6][7] • Hospice is appropriate for advanced cancer with limited function when disease-directed evaluation/treatment is declined; hospice involvement is associated with better symptom control and caregiver outcomes, and in metastatic prostate cancer is commonly used and can reduce burdensome hospital utilization. Spinal metastasis with impaired ambulation portends limited prognosis, supporting hospice eligibility discussions.[2][4][7][8] Incorrect options: • A and C: Further persuasion/oncology consult may undermine the patient’s stated refusal and risk coercion.[1][5] • B: Minimizes potential benefits of hospice and does not address abandonment concerns.[2][3] • E: Assisted living is a residential model, not a care plan addressing end-of- life needs; hospice provides the necessary scope of services.[2][7] Correct answer: (D) Reassure the daughter and recommend hospice care consultation.[1][2][3][4]";"1. Referring a Patient and Family to High-Quality Palliative Care at the Close of Life: “We Met a New Personality . . . With This Level of Compassion and Empathy”. Teno JM, Connor SR.. JAMA. 2009;301(6):651-9. doi:10.1001/ jama.2009.109. 2. Beyond Advance Directives: Importance of Communication Skills at the End of Life. Tulsky JA.. JAMA. 2005;294(3):359-65. doi:10.1001/ jama.294.3.359. 3. Conflicts Regarding Decisions to Limit Treatment: A Differential Diagnosis. Goold SD, Williams B, Arnold RM.. JAMA. 2000;283(7):909-14. doi:10.1001/ jama.283.7.909. 4. Burden of Hospital Admissions and Utilization of Hospice Care in Metastatic Prostate Cancer Patients. Sammon JD, McKay RR, Kim SP, et al.. Urology. 2015;85(2):343-9. doi:10.1016/j.urology.2014.09.053. 5. Refusal of Care: Patients' Well-being and Physicians' Ethical Obligations: “But Doctor, I Want to Go Home”. Carrese JA.. JAMA. 2006;296(6):691-5. doi:10.1001/jama.296.6.691. 6. Three Kinds of Decision-Making Capacity for Refusing Medical Interventions. Navin MC, Brummett AL, Wasserman JA.. The American Journal of Bioethics : AJOB. 2022;22(11):73-83. doi:10.1080/15265161.2021.1941423. 7. Variation in Hospice Services by Location of Care: Nursing Home Versus Assisted Living Facility Versus Home. Unroe KT, Bernard B, Stump TE, Tu W, Callahan CM.. Journal of the American Geriatrics Society. 2017;65(7):1490-1496. doi:10.1111/jgs.14826. 8. Prognostic Factors for Overall Survival in Patients With Spinal Metastasis Secondary to Prostate Cancer: A Systematic Review and Meta-Analysis. Gao ZY, Zhang T, Zhang H, Pang CG, Jiang WX.. BMC Musculoskeletal Disorders. 2020;21(1):388. doi:10.1186/s12891-020-03412-0."
223;Question 25.1 (MC-NJ) - Step 3;"A 23-year-old man comes to the office because of a 7-day history of fever, crampy abdominal pain, and diarrhea. He says the abdominal pain worsens with oral intake. He has been having 8 to 10 episodes of diarrhea daily. He has not traveled recently and has had no sick contacts. Medical history is unremarkable and he takes no medications. He does not smoke cigarettes, drink alcoholic beverages, or use illicit drugs. He is not sexually active. Vital signs are temperature 38.3°C (101.0°F), pulse 118/min, respirations 18/min, and blood pressure 108/58 mm Hg. Bowel sounds are hyperactive. The abdomen is diffusely tender to palpation; no masses are palpated. Neither the liver edge nor the spleen can be palpated. Digital rectal examination shows grossly bloody stool. A stool culture is obtained, and empiric pharmacotherapy is initiated. Which of the following microorganisms is the most likely cause of this patient's condition?";(A) Campylobacter jejuni (B) Candida albicans (C) Enterovirus (D) Giardia lamblia ;A;A;https://openevidence.com/usmle-results/step-3-;"Campylobacter jejuni Campylobacter jejuni is the best fit for this patient’s acute febrile, crampy abdominal pain with frequent grossly bloody diarrhea (dysentery). The Infectious Diseases Society of America (IDSA) highlights that visible blood in stool with fever and abdominal pain suggests an invasive bacterial etiology such as Campylobacter, Shigella, Salmonella, or STEC; among the listed options, Campylobacter is most consistent with this presentation in a young adult without travel.[1] The IDSA and American Society for Microbiology note that routine stool testing for febrile/bloody diarrhea targets Campylobacter, Salmonella, Shigella, and STEC, supporting Campylobacter as a likely recoverable pathogen in this context.[2] Campylobacter commonly causes crampy pain, fever, and inflammatory/bloody diarrhea and does not require travel exposure.[3][4] By contrast: • Giardia lamblia typically causes afebrile, non-bloody, fatty/malodorous diarrhea with steatorrhea; invasive, grossly bloody stools are atypical.[1][5] [6] • Candida albicans is not a typical cause of acute bloody diarrhea in immunocompetent hosts. • Enteroviruses have not been consistently established as causes of grossly bloody diarrhea in adults; they more often cause non-bloody gastroenteritis or systemic syndromes.[7] Empiric therapy for severe/dysenteric illness is reasonable; macrolides (e.g., azithromycin) are preferred when treating suspected Campylobacter, given fluoroquinolone resistance patterns, as reflected in public health guidance and contemporary reviews.[1][3][4]";"1. 2017 Infectious Diseases Society of America Clinical Practice Guidelines for the Diagnosis and Management of Infectious Diarrhea. Shane AL, Mody RK, Crump JA, et al.. Clinical Infectious Diseases : An Official Publication of the Infectious Diseases Society of America. 2017;65(12):e45-e80. doi:10.1093/ cid/cix669. 2. Campylobacter Jejuni/Coli Infection: Is It Still a Concern?. Veronese P, Dodi I.. Microorganisms. 2024;12(12):2669. doi:10.3390/ microorganisms12122669. 3. Giardiasis. Wolfe MS.. Clinical Microbiology Reviews. 1992;5(1):93-100. doi:10.1128/CMR.5.1.93. 4. Review Article: The Management of Giardiasis. Vesy CJ, Peterson WL.. Alimentary Pharmacology & Therapeutics. 1999;13(7):843-50. doi:10.1046/ j.1365-2036.1999.00537.x. 5. Enteroviruses in Gastrointestinal Diseases. Rao CD.. Reviews in Medical Virology. 2021;31(1):1-12. doi:10.1002/rmv.2148. 6. Guide to Utilization of the Microbiology Laboratory for Diagnosis of Infectious Diseases: 2024 Update by the Infectious Diseases Society of America (IDSA) and the American Society for Microbiology (ASM). Miller JM, Binnicker MJ, Campbell S, et al.. Clinical Infectious Diseases : An Official Publication of the Infectious Diseases Society of America. 2024;:ciae104. doi:10.1093/cid/ciae104. 7. Campylobacteriosis. Farrell Tobolowsky, Mark Laughlin, Rachael Aubert, Daniel Payne. CDC Yellow Book"
224;Question 26.1 (MC-NJ) - Step 3;"A 23-year-old man comes to the office because of a 7-day history of fever, crampy abdominal pain, and diarrhea. He says the abdominal pain worsens with oral intake. He has been having 8 to 10 episodes of diarrhea daily. He has not traveled recently and has had no sick contacts. Medical history is unremarkable and he takes no medications. He does not smoke cigarettes, drink alcoholic beverages, or use illicit drugs. He is not sexually active. Vital signs are temperature 38.3°C (101.0°F), pulse 118/min, respirations 18/min, and blood pressure 108/58 mm Hg. Bowel sounds are hyperactive. The abdomen is diffusely tender to palpation; no masses are palpated. Neither the liver edge nor the spleen can be palpated. Digital rectal examination shows grossly bloody stool. A stool culture is obtained, and empiric pharmacotherapy is initiated. Results of the stool culture show growth of Campylobacter jejuni. The patient returns to the office 3 weeks later. He reports total resolution of his fever and gastrointestinal symptoms after completion of prescribed ciprofloxacin therapy, but he has had pain and swelling of his left knee during the past 3 days. The pain worsens with weight bearing. He rates the pain as a 6 on a 10-point scale. Vital signs are temperature 37.1°C (98.8°F), pulse 78/ min, respirations 16/min, and blood pressure 112/58 mm Hg. Physical examination discloses erythema and warmth of the left knee with marked synovitis. Direct palpation and flexion of the knee elicit pain. Which of the following is the most appropriate diagnostic study to determine the cause of this patient's symptoms?";(A) Blood cultures (B) CD4+ T-lymphocyte count (C) Human leukocyte antigen-B27 assay (D) Serum rheumatoid factor assay (E) Stool culture;C;C;https://openevidence.com/usmle-results/step-3-;"C) Human leukocyte antigen-B27 assay This presentation is classic for post-enteric reactive arthritis (ReA) developing 1– 4 weeks after culture-confirmed Campylobacter jejuni gastroenteritis, with an acute asymmetric large-joint monoarthritis of the lower extremity and no ongoing systemic toxicity.[1][2][3][4][5] The diagnostic approach to ReA is primarily clinical and anchored by documentation of the triggering infection; microbial cultures of blood, stool, or synovial fluid are typically negative once arthritis manifests.[4][5] HLA-B27 is associated with the spondyloarthritis spectrum, influences disease severity and chronicity, and is commonly obtained to support classification and prognostication in suspected ReA, although it is neither necessary nor sufficient for diagnosis and many Campylobacter- triggered cases are HLA-B27 negative.[1][2][4][5][6] Why the other options are less appropriate here: • Blood cultures: indicated when septic arthritis is suspected with systemic features; yield is sporadic and synovial fluid testing is preferred.[7][8] • CD4+ count: no indication (patient has no HIV risk factors; CD4 testing does not inform ReA).[4][5] • Serum rheumatoid factor: ReA is seronegative; RF does not aid diagnosis in this context.[4][5] • Stool culture: the triggering pathogen has already been identified; repeat stool testing does not inform postinfectious arthritis.[4][5] Note: If clinical concern for septic arthritis persists (e.g., high fever, rigors, immunocompromise), arthrocentesis with synovial fluid cell count, Gram stain, and culture is the recommended diagnostic test to exclude infection per the Infectious Diseases Society of America and standard reviews.[7][8][9]";"1. Campylobacter-Triggered Reactive Arthritis: A Population-Based Study. Hannu T, Mattila L, Rautelin H, et al.. Rheumatology (Oxford, England). 2002;41(3):312-8. doi:10.1093/rheumatology/41.3.312. 2. Reactive Arthritis Following Culture-Confirmed Infections With Bacterial Enteric Pathogens in Minnesota and Oregon: A Population-Based Study. Townes JM, Deodhar AA, Laine ES, et al.. Annals of the Rheumatic Diseases. 2008;67(12):1689-96. doi:10.1136/ard.2007.083451. 3. Campylobacteriosis. Farrell Tobolowsky, Mark Laughlin, Rachael Aubert, Daniel Payne. CDC Yellow Book 4. Diagnosis and Classification of Reactive Arthritis. Selmi C, Gershwin ME.. Autoimmunity Reviews. 2014 Apr-May;13(4-5):546-9. doi:10.1016/ j.autrev.2014.01.005. 5. Reactive Arthritis. Hannu T.. Best Practice & Research. Clinical Rheumatology. 2011;25(3):347-57. doi:10.1016/j.berh.2011.01.018. 6. HLA-B27 Negative Reactive Arthritis Versus HLA-B27 Positive Reactive Arthritis: A Retrospective Study. Ding Y, Xue L.. Medicine. 2022;101(35):e30383. doi:10.1097/MD.0000000000030383. 7. Guide to Utilization of the Microbiology Laboratory for Diagnosis of Infectious Diseases: 2024 Update by the Infectious Diseases Society of America (IDSA) and the American Society for Microbiology (ASM). Miller JM, Binnicker MJ, Campbell S, et al.. Clinical Infectious Diseases : An Official Publication of the Infectious Diseases Society of America. 2024;:ciae104. doi:10.1093/cid/ciae104. 8. Septic Arthritis: Diagnosis and Treatment. Earwood JS, Walker TR, Sue GJC.. American Family Physician. 2021;104(6):589-597. 9. Does This Adult Patient Have Septic Arthritis?. Margaretten ME, Kohlwes J, Moore D, Bent S.. JAMA. 2007;297(13):1478-88. doi:10.1001/jama.297.13.1478."
225;Question 27.1 (MC-NJ) - Step 3;A 46-year-old woman, gravida 1, para 1, comes to the office because of a 2- week history of black discharge from her right nipple. The patient had mammography and ultrasonography of the breasts 2 months ago for evaluation of increased glandularity, palpated in the upper outer quadrant of the right breast, noted at her most recent annual examination. The studies showed likely benign findings with recommended follow-up in 6 months. Medical history is otherwise unremarkable and she takes no medications. BMI is 30 kg/m2 . Vital signs are normal. Palpation of the right breast discloses glandularity in the upper outer quadrant but no other masses. There is scant, black discharge from the right nipple. Which of the following is the most appropriate next step in diagnosis?;(A) Ductography (B) Excisional biopsy of glandular tissue (C) Repeat mammography (D) Repeat ultrasonography of the right breast (E) No further workup is indicated;A;A;https://openevidence.com/usmle-results/step-3-;"The presentation is consistent with pathologic nipple discharge (unilateral, spontaneous), which warrants additional diagnostic evaluation beyond routine follow-up despite recent “likely benign” mammography and ultrasonography.[1] Contemporary literature supports breast MRI as the preferred next study after negative mammography and ultrasonography because of its high sensitivity/NPV and ability to identify lesions requiring excision; it is favored over ductography for problem solving in this setting.[2][3][4][5][6] Color is not a reliable discriminator; nonbloody/black discharge still carries clinically relevant risk, particularly when unilateral and spontaneous, and should not defer workup.[1][7] [8] Because MRI is not an option among the choices provided, the best available next step to evaluate for intraductal pathology (e.g., papilloma, atypia, carcinoma) is Ductography. This test can localize a causative ductal lesion in patients with pathologic discharge when conventional imaging is negative, although MRI generally offers superior diagnostic performance and patient comfort and is increasingly used in lieu of ductography.[2][3][4][6][9] • Excisional biopsy of “glandular tissue” is not the next step; surgery is typically targeted (central duct excision or lesion-directed) after imaging.[1] [2] • Repeat mammography/ultrasonography at 2 months adds little yield after a recent negative/“probably benign” exam; problem-solving imaging is preferred.[2][3][4] • No further workup is inappropriate given pathologic features.[1]";"1. Common Breast Problems. Salzman B, Collins E, Hersh L.. American Family Physician. 2019;99(8):505-514. 2. Nipple Discharge: Current Clinical and Imaging Evaluation. Gupta D, Mendelson EB, Karst I.. AJR. American Journal of Roentgenology. 2021;216(2):330-339. doi:10.2214/AJR.19.22025. 3. Nipple Discharge Imaging Evaluation With Mammography, Ultrasound, Galactography, and MRI. Chung HL, Bevers TB, Legha RS, et al.. Academic Radiology. 2023;30(5):783-797. doi:10.1016/j.acra.2022.05.013. 4. Network Meta-Analysis for the Diagnostic Approach to Pathologic Nipple Discharge. Filipe MD, Patuleia SIS, de Jong VMT, et al.. Clinical Breast Cancer. 2020;20(6):e723-e748. doi:10.1016/j.clbc.2020.05.015. 5. Diagnostic Performance of MRI Versus Galactography in Women With Pathologic Nipple Discharge: A Systematic Review and Meta-Analysis. Berger N, Luparia A, Di Leo G, et al.. AJR. American Journal of Roentgenology. 2017;209(2):465-471. doi:10.2214/AJR.16.16682. 6. Magnetic Resonance Imaging in the Evaluation of Pathologic Nipple Discharge: Indications and Imaging Findings. Samreen N, Madsen LB, Chacko C, Heller SL.. The British Journal of Radiology. 2021;94(1120):20201013. doi:10.1259/bjr.20201013. 7. Does Nipple Discharge Color Predict (Pre-) Malignant Breast Pathology?. Wong Chung JE, Jeuriens-van de Ven SA, van Helmond N, et al.. The Breast Journal. 2016 Mar-Apr;22(2):202-8. doi:10.1111/tbj.12544. 8. Diagnostic Value of Endoscopic Appearance During Ductoscopy in Patients With Pathological Nipple Discharge. Han Y, Li J, Han S, et al.. BMC Cancer. 2017;17(1):300. doi:10.1186/s12885-017-3288-3. 9. Diagnostic Accuracy of Breast MRI for Patients With Suspicious Nipple Discharge and Negative Mammography and Ultrasound: A Prospective Study. Boisserie-Lacroix M, Doutriaux-Dumoulin I, Chopier J, et al.. European Radiology. 2021;31(10):7783-7791. doi:10.1007/s00330-021-07790-4."
226;Question 28.1 (MC-NJ) - Step 3;A physician is conducting a retrospective review of a trial involving the use of Drug X in patients with a specific disease. It is known that Drug X is associated with an increased probability of cancer in patients who use the drug. A total of 600 individuals with a specific disease were included in the trial. Of the participants, 200 individuals received Drug X and 400 individuals did not receive it. One hundred individuals who received Drug X died of a particular type of cancer and 100 individuals who did not receive the drug died of the same type of cancer. Based on these data, which of the following is the relative risk of death from this type of cancer in individuals who take Drug X as compared with individuals who do not take Drug X?;(A) Individuals who take Drug X have an equal risk of dying from this type of cancer (B) Individuals who take Drug X have four times the risk of dying from this type of cancer (C) Individuals who take Drug X have three times the risk of dying from this type of cancer (D) Individuals who take Drug X have two times the risk of dying from this type of cancer (E) The risk for dying cannot be determined from the data;D;D;https://openevidence.com/usmle-results/step-3-;"Individuals who take Drug X have two times the risk of dying from this type of cancer compared to those who do not take Drug X, making option (D) correct. Relative risk (RR) is calculated as: RR = risk in exposed ÷ risk in unexposed = (100/200) ÷ (100/400) = 0.5 ÷ 0.25 = 2.0. This reflects a doubling of risk among those who received Drug X, consistent with standard cohort/retrospective cohort effect estimation.[1][2] This is distinct from the odds ratio, which can diverge from RR when the outcome is common; here, RR is directly estimable because event counts and denominators are known in both exposure groups.[3][4] Conceptually, this is the canonical application of RR in cohort data, aligning with epidemiologic practice for risk ratios and attributable measures.[1][2] While lifetime or time-varying exposure considerations can complicate causal interpretation in some cohort contexts, the arithmetic RR from these cell counts is straightforward and appropriate for this question.[5][6]";"1. Understanding Relative Risk, Odds Ratio, and Related Terms: As Simple as It Can Get. Andrade C.. The Journal of Clinical Psychiatry. 2015;76(7):e857-61. doi:10.4088/JCP.15f10150. 2. Measures of Effect: Relative Risks, Odds Ratios, Risk Difference, and 'Number Needed to Treat'. Tripepi G, Jager KJ, Dekker FW, Wanner C, Zoccali C.. Kidney International. 2007;72(7):789-91. doi:10.1038/ sj.ki.5002432. 3. Odds Ratios and Risk Ratios: What's the Difference and Why Does It Matter?. Viera AJ.. Southern Medical Journal. 2008;101(7):730-4. doi:10.1097/ SMJ.0b013e31817a7ee4. 4. Relative Risks and Odds Ratios: Simple Rules on When and How to Use Them. McKenzie DP, Thomas C.. European Journal of Clinical Investigation. 2020;:e13249. doi:10.1111/eci.13249. 5. Calculation of Lifetime Relative Risks From Summary Cohort Data and Application to Calculation of Attributable Fractions. Ferguson J.. Annals of Epidemiology. 2025;102:102-113. doi:10.1016/j.annepidem.2025.01.008. 6. Understanding Misunderstandings About the Relative Risk and Odds Ratio. Andrade C.. The Journal of Clinical Psychiatry. 2023;84(3):23f14943. doi:10.4088/JCP.23f14943."
