#;Identificador;Pergunta;Opcoesrespostas;Resposta Correta;Resposta OpenEvidence;Link OpenEvidence;Explicacao OpenEvidence;Referências
227;Question 29.1 (MC-NJ) - Step 3;A 23-year-old woman is brought to the emergency department by her friend because of headache, vomiting, and diarrhea that developed rapidly 6 hours ago. She also has had associated fever, chills, generalized muscle pain, and diffuse rash. The patient previously was healthy and has had no known exposure to anyone who has been ill. Medical history is unremarkable and her only medication is an oral contraceptive. She is currently menstruating. She does not smoke cigarettes or use illicit drugs. She drinks one to two alcoholic beverages weekly. She is disoriented to person, place, and time. Vital signs are temperature 39.2°C (102.6°F), pulse 114/min, respirations 26/min, and blood pressure 82/44 mm Hg. Pulse oximetry on oxygen at 2 L/min via nasal cannula shows an oxygen saturation of 90%. Examination of the skin shows diffuse macular erythema. Lungs are clear to auscultation. Cardiac examination discloses normal heart sounds and no murmur. Bowel sounds are hypoactive. Results of laboratory studies are shown: Serum Blood ALT: 164 U/L Hemoglobin: 16.4 g/dL AST: 130 U/L WBC 14,300/mm³ with left shift Urea nitrogen: 57 mg/dL Platelet count 52,000/mm3 Creatinine 2.2 mg/dL Can you provide me a diagnosis for this case? Given your diagnosis, a response to which of the following choices below is the most likely cause of this patient's condition?;(A) Bacterial endotoxin (B) Bacterial exotoxin (C) Immunoglobulin E antibody (D) Immunoglobulin G antibody (E) Viral capsid (F) Viral coat;B;B;https://openevidence.com/usmle-results/step-3-;"The presentation is classic for staphylococcal toxic shock syndrome: abrupt high fever, hypotension with shock, diffuse “sunburn-like” macular erythroderma, vomiting/diarrhea, myalgias, altered mental status, and multiorgan involvement (renal injury, elevated transaminases, thrombocytopenia, hemoconcentration) in a menstruating woman. Staphylococcal TSS is a toxin-mediated illness; TSST-1 and related staphylococcal superantigens drive massive T-cell activation and cytokine release, producing the rapid systemic toxicity described.[1] Meningococcemia more typically causes a petechial/purpuric rash and purpura fulminans, DRESS is a delayed T cell–mediated drug reaction with eosinophilia rather than shock, and acute viral exanthems do not present with distributive shock and multiorgan failure.[2][3][4] Isolated acute liver failure would center on encephalopathy/coagulopathy rather than this multisystem toxin-mediated picture.[5] Diagnosis: staphylococcal toxic shock syndrome. Most likely cause: Bacterial exotoxin. Key management (for completeness): immediate aggressive IV fluids and vasopressors for shock; source control; antistaphylococcal coverage (e.g., vancomycin if MRSA prevalence is high) plus a protein synthesis inhibitor to suppress toxin production (clindamycin or linezolid) as recommended in emergency medicine literature.[1]";"1. The Evaluation and Management of Toxic Shock Syndrome in the Emergency Department: A Review of the Literature. Gottlieb M, Long B, Koyfman A.. The Journal of Emergency Medicine. 2018;54(6):807-814. doi:10.1016/j.jemermed.2017.12.048. 2. Meningococcal Disease. Lucy McNamara, Amy Blain. CDC Yellow Book 3. Drug-Induced Hypersensitivity Syndrome (DIHS)/Drug Reaction With Eosinophilia and Systemic Symptoms (DRESS): Clinical Features and Pathogenesis. Hama N, Abe R, Gibson A, Phillips EJ.. The Journal of Allergy and Clinical Immunology. In Practice. 2022;10(5):1155-1167.e5. doi:10.1016/ j.jaip.2022.02.004. 4. Dermatological Manifestations of Epstein-Barr Virus Systemic Infection: A Case Report and Literature Review. Ciccarese G, Trave I, Herzum A, Parodi A, Drago F.. International Journal of Dermatology. 2020;59(10):1202-1209. doi:10.1111/ijd.14887. 5. Acute Liver Failure Guidelines. Shingina A, Mukhtar N, Wakim-Fleming J, et al.. The American Journal of Gastroenterology. 2023;118(7):1128-1153. doi:10.14309/ajg.0000000000002340."
228;Question 30.1 (MC-NJ) - Step 3;"A 68-year-old man comes to the office because of a 4-week history of increasing stiffness in his shoulders and upper arms. He is an avid golfer and has been unable to play in the morning because of the stiffness. He says that the stiffness is somewhat improved in the afternoon. He also has felt fatigued and sometimes ""headachy and feverish."" Medical history is significant for arthritis in his knees treated with acetaminophen, which has not relieved his shoulder and arm pain, and hyperlipidemia treated with pravastatin. He is a retired radiologist. Vital signs are temperature 37.7°C (99.8°F), pulse 76/min, respirations 18/min, and blood pressure 145/80 mm Hg. There is no tenderness in the shoulder girdle, and range of motion is normal bilaterally. The remainder of the physical examination discloses no abnormalities. Results of additional laboratorystudies are shown: Serum Blood Creatine kinase 88 U/L Hematocrit 36% Hemoglobin 12.0 g/dL WBC 8600/mm3 ESR 88 mm/h Which of the following is the most significant risk factor for the development of this patient's condition?";(A) Age (B) Gender (C) History of osteoarthritis (D) Previous occupation (E) Use of pravastatin;A;A;https://openevidence.com/usmle-results/step-3-;"Age This presentation is classic for polymyalgia rheumatica (PMR): subacute bilateral shoulder girdle stiffness with marked morning predominance, constitutional symptoms, anemia of inflammation, normal CK, and very elevated ESR. PMR occurs almost exclusively in persons older than 50 years, with peak incidence in the 70s; advanced age is the strongest and most consistent epidemiologic risk factor and is effectively required for diagnosis.[1][2][3][4][5][6] • Gender: PMR is 2–3 times more common in women, but this confers less risk than age and is not requisite.[3][4][5][6] • Osteoarthritis history and previous occupation: not established risk factors for PMR.[1][2][3][4][5] • Pravastatin use: statins can cause myalgias and rarely inflammatory myopathies; signal-level data suggest an association with PMR reports, but causality is uncertain and statin exposure is not considered a major risk factor for true PMR in epidemiologic reviews and guidelines.[3][5][7][8][9]";"1. Polymyalgia Rheumatica. Espígol-Frigolé G, Dejaco C, Mackie SL, et al.. Lancet (London, England). 2023;402(10411):1459-1472. doi:10.1016/ S0140-6736(23)01310-7. 2. Polymyalgia Rheumatica. González-Gay MA, Matteson EL, Castañeda S.. Lancet (London, England). 2017;390(10103):1700-1712. doi:10.1016/ S0140-6736(17)31825-1. 3. Giant-Cell Arteritis and Polymyalgia Rheumatica. Weyand CM, Goronzy JJ.. The New England Journal of Medicine. 2014;371(1):50-7. doi:10.1056/ NEJMcp1214825. 4. Polymyalgia Rheumatica and Giant Cell Arteritis: A Systematic Review. Buttgereit F, Dejaco C, Matteson EL, Dasgupta B.. JAMA. 2016;315(22):2442-58. doi:10.1001/jama.2016.5444. 5. Polymyalgia Rheumatica and Giant Cell Arteritis: Rapid Evidence Review. Raleigh MF, Stoddard J, Darrow HJ.. American Family Physician. 2022;106(4):420-426. 6. Statin-Associated Polymyalgia Rheumatica. An Analysis Using WHO Global Individual Case Safety Database: A Case/Non-Case Approach. de Jong HJ, Saldi SR, Klungel OH, et al.. PloS One. 2012;7(7):e41289. doi:10.1371/ journal.pone.0041289. 7. An Update on Polymyalgia Rheumatica. Lundberg IE, Sharma A, Turesson C, Mohammad AJ.. Journal of Internal Medicine. 2022;292(5):717-732. doi:10.1111/joim.13525. 8. Association of Statin Exposure With Histologically Confirmed Idiopathic Inflammatory Myositis in an Australian Population. Caughey GE, Gabb GM, Ronson S, et al.. JAMA Internal Medicine. 2018;178(9):1224-1229. doi:10.1001/ jamainternmed.2018.2859. 9. Association of Statin Use With Increased Risk of Musculoskeletal Conditions: A Retrospective Cohort Study. Makris UE, Alvarez CA, Mortensen EM, Mansi IA.. Drug Safety. 2018;41(10):939-950. doi:10.1007/ s40264-018-0682-y."
229;Question 31.1 (MC-NJ) - Step 3;A 16-month-old girl is brought to the emergency department by emergency medical technicians because of a generalized tonic-clonic seizure that began 25 minutes ago and has continued despite administration of 0.5 mg/kg rectal diazepam 10 minutes ago. The patient was at home at the time of the seizure. In the emergency department, she is given an additional 0.5 mg/kg dose of diazepam intravenously and the convulsion terminates. Within 2 minutes, her oxygen saturation drops to 75% and she appears cyanotic. Respirations are 10/min and shallow. She receives bag-valve-mask ventilation, followed by intubation and mechanical ventilation. Medical history is unremarkable. She takes no medications. Temperature is 39.1°C (102.5°F). Which of the following is the most likely underlying cause of the patient's respiratory insufficiency?;(A) Airway occlusion (B) Encephalitis (C) Medication-induced suppression of central respiratory drive (D) Meningitis (E) Ongoing nonconvulsive seizure activity;C;C;https://openevidence.com/usmle-results/step-3-;"Medication-induced suppression of central respiratory drive (C) The child received two benzodiazepine doses (rectal 0.5 mg/kg diazepam prehospital, then IV 0.5 mg/kg diazepam in the ED) with seizure termination followed within minutes by hypoxemia, bradypnea, and shallow respirations— classic for benzodiazepine-related hypoventilation. Benzodiazepines depress central respiratory drive via GABA-A agonism and can cause loss of airway protective reflexes; risk increases with repeated and IV dosing and frequently necessitates assisted ventilation in pediatric status epilepticus management.[1][2] [3][4][5] The American Epilepsy Society’s evidence synthesis notes similar assisted ventilation rates with IV diazepam and lorazepam, underscoring this known complication.[4] Pediatric studies document clinically significant respiratory depression after rectal and IV diazepam, particularly with multiple doses.[1][2] Alternative explanations are less likely: • Airway occlusion: no mention of obstruction or trauma; temporally linked to sedative dosing. • Encephalitis/meningitis: fever is present, but abrupt respiratory failure immediately post-benzodiazepine dosing favors drug effect; infectious etiologies would not typically cause immediate shallow bradypnea after seizure cessation. • Ongoing nonconvulsive seizures: hypoventilation began after clinical seizure termination; benzodiazepine effect better explains the rapid fall in respiratory rate and SpO2. Continuous EEG would be appropriate later if concern persists.[6][7][8] Management appropriately included bag-mask ventilation and intubation; flumazenil is generally avoided in seizure patients due to proconvulsant risk despite its capacity to reverse benzodiazepine-induced respiratory depression, as highlighted by the American Heart Association.[9]";"1. Respiratory Depression in Children Receiving Diazepam for Acute Seizures: A Prospective Study. Norris E, Marzouk O, Nunn A, McIntyre J, Choonara I.. Developmental Medicine and Child Neurology. 1999;41(5):340-3. doi:10.1017/ s0012162299000742. 2. Respiratory Depression in the Acute Management of Seizures. Stewart WA, Harrison R, Dooley JM.. Archives of Disease in Childhood. 2002;87(3):225-6. doi:10.1136/adc.87.3.225. 3. Drug Management for Acute Tonic-Clonic Convulsions Including Convulsive Status Epilepticus in Children. McTague A, Martland T, Appleton R.. The Cochrane Database of Systematic Reviews. 2018;1:CD001905. doi:10.1002/14651858.CD001905.pub3. 4. 2023 American Heart Association Focused Update on the Management of Patients With Cardiac Arrest or Life-Threatening Toxicity Due to Poisoning: An Update to the American Heart Association Guidelines for Cardiopulmonary Resuscitation and Emergency Cardiovascular Care. Lavonas EJ, Akpunonu PD, Arens AM, et al.. Circulation. 2023;148(16):e149- e184. doi:10.1161/CIR.0000000000001161. 5. Effect of Diazepam on Ventilatory Responses. Lakshminarayan S, Sahn SA, Hudson LD, Weil JV.. Clinical Pharmacology and Therapeutics. 1976;20(2):178-83. doi:10.1002/cpt1976202178. 6. Randomized Trial of Three Anticonvulsant Medications for Status Epilepticus. Kapur J, Elm J, Chamberlain JM, et al.. The New England Journal of Medicine. 2019;381(22):2103-2113. doi:10.1056/NEJMoa1905795. 7. Hypoxemia Following Generalized Convulsive Seizures: Risk Factors and Effect of Oxygen Therapy. Rheims S, Alvarez BM, Alexandre V, et al.. Neurology. 2019;92(3):e183-e193. doi:10.1212/WNL.0000000000006777. 8. Abnormalities in Cardiac and Respiratory Function Observed During Seizures in Childhood. O'Regan ME, Brown JK.. Developmental Medicine and Child Neurology. 2005;47(1):4-9. doi:10.1017/s0012162205000022. 9. Lorazepam vs Diazepam for Pediatric Status Epilepticus: A Randomized Clinical Trial. Chamberlain JM, Okada P, Holsti M, et al.. JAMA. 2014 Apr 23-30;311(16):1652-60. doi:10.1001/jama.2014.2625."
230;Question 32.1 (MC-NJ) - Step 3;A 32-year-old woman comes to the emergency department because of a 3- day history of fatigue and postural light- headedness. She also reports nausea with one episode of vomiting this morning and adds that her stools and urine have been darker than usual lately. Medical history is significant for stage III-B Hodgkin lymphoma. She started the first cycle of chemotherapy 8 days ago. Additional medications include ferrous gluconate, hydrocodone, and prochlorperazine. She is currently receiving 0.9% saline at 75 mL/hr. Vital signs today are temperature 37.5°C (99.5°F), pulse 76/min supine and 80/min standing, respirations 16/min, and blood pressure 125/65 mm Hg supine and 120/60 mm Hg standing. Pulse oximetry on room air shows an oxygen saturation of 94%. Lungs are clear to auscultation. Cardiac examination discloses a soft systolic murmur at the left upper sternal border. There is no hepatosplenomegaly or tenderness on abdominal examination. Rectal examination discloses no masses. Stool is black and test for occult blood is negative. Results of laboratory studies are shown: Blood Urine Hematocrit 24% Specific gravity 1.032 (N=1.010–1.025) WBC 2400/mm3 Bilirubin Negative Platelet count 78,000/mm3 RBC Negative Which of the following is the most likely explanation for the patient's current condition?;(A) Adverse effect of medications (B) Bone marrow metastases (C) Gastrointestinal blood loss (D) Hemodilution (E) Hemolytic anemia;A;A;https://openevidence.com/usmle-results/step-3-;"The most likely explanation is Adverse effect of medications. Rationale: • Concurrent anemia (Hct 24%), neutropenia (WBC 2.4 K/µL), and thrombocytopenia (78 K/µL) in a patient actively receiving chemotherapy for Hodgkin lymphoma are most consistent with chemotherapy-induced myelosuppression, a well-described toxicity in this setting. The National Comprehensive Cancer Network (NCCN) notes chemotherapy as a major contributor to cancer-associated anemia and cytopenias.[1] • Black stools with a negative guaiac in a patient on ferrous gluconate reflect iron-induced stool discoloration rather than GI bleeding. Therapeutic-dose ferrous sulfate/gluconate does not cause false-positive or false-negative guaiac (Hemoccult) tests and does not increase occult GI blood loss by HemoQuant; this supports that darker stools are from iron, not bleeding. Dark urine with negative urine bilirubin and RBCs argues against hemoglobinuria or bilirubinuria and thus against hemolysis or hematuria.[2] [3] • Hemolytic anemia is not supported: no bilirubinuria, no hematuria; typical lab constellation (↑LDH, ↑indirect bilirubin, ↓haptoglobin, reticulocytosis) is not suggested here.[4][5] • Hemodilution is unlikely: she is on a low-rate isotonic saline (75 mL/hr) and has high urine specific gravity (1.032), suggesting relative volume depletion rather than dilution; maintenance-rate saline does not meaningfully lower hematocrit or platelets.[6][7] • Bone marrow involvement by Hodgkin lymphoma can cause cytopenias, but in the context of ongoing cytotoxic therapy, chemotherapy-induced suppression is more probable; marrow infiltration typically is considered when cytopenias are unexplained by recent chemotherapy.[8][9]";"1. Cancer- And Chemotherapy-Induced Anemia. Rodgers GM, Becker PS, Blinder M, et al.. Journal of the National Comprehensive Cancer Network : JNCCN. 2012;10(5):628-53. doi:10.6004/jnccn.2012.0064. 2. Use of HemoQuant Assays to Assess the Effect of Oral Iron Preparations on Stool Hemoccult Tests. Coles EF, Starnes EC.. The American Journal of Gastroenterology. 1991;86(10):1442-4. 3. Influence of Iron Preparations on Occult Blood Tests. ILLINGWORTH DG.. Journal of Clinical Pathology. 1965;18:103-4. doi:10.1136/jcp.18.1.103. 4. Hemolytic Anemia: Evaluation and Differential Diagnosis. Phillips J, Henderson AC.. American Family Physician. 2018;98(6):354-361. 5. Hemolytic Anemia. Dhaliwal G, Cornett PA, Tierney LM.. American Family Physician. 2004;69(11):2599-606. 6. Dilution and Redistribution Effects of Rapid 2-Litre Infusions of 0.9% (W/ V) Saline and 5% (W/V) Dextrose on Haematological Parameters and Serum Biochemistry in Normal Subjects: A Double-Blind Crossover Study. Lobo DN, Stanga Z, Simpson JA, et al.. Clinical Science (London, England : 1979). 2001;101(2):173-9. 7. Does Hemodilution Exist? Effects of Saline Infusion on Hematologic Parameters in Euvolemic Subjects. Grathwohl KW, Bruns BJ, LeBrun CJ, et al.. Southern Medical Journal. 1996;89(1):51-5. doi:10.1097/00007611-199601000-00008. 8. Hodgkin's Disease in the Bone Marrow. Weiss RB, Brunning RD, Kennedy BJ.. Cancer. 1975;36(6):2077-83. doi:10.1002/cncr.2820360924. 9. The Bone Marrow in Hodgkin's Disease: The Non-Involved Marrow. Te Velde J, Den Ottolander GJ, Spaander PJ, Van Den Berg C, Hartgrink- Groeneveld CA.. Histopathology. 1978;2(1):31-46. doi:10.1111/ j.1365-2559.1978.tb01691.x."
231;Question 33.1 (MC-NJ) - Step 3;"A male neonate, who was born at 36 weeks' gestation 2 hours ago in the labor and delivery unit of the hospital, now shows signs of respiratory difficulty. The mother, an 18-year-old primigravid woman, smoked one pack of cigarettes daily throughout her pregnancy. She received prenatal care during most of the pregnancy. One episode of chlamydial cervicitis was detected during the last trimester and treated with azithromycin. The neonate was born via cesarean delivery due to fetal heart rate decelerations. The amniotic fluid was stained with light particulate meconium. Apgar scores were 9 and 9 at 1 and 5 minutes, respectively. The patient is 50 cm (20 in; 50th percentile) long and weighs 3005 g (6 lb 10 oz; 50th percentile); head circumference is 35 cm (14 in; 50th percentile). The infant's vital signs now are temperature 36.6°C (97.8°F), pulse 150/min, and respirations 70/min. Pulse oximetry on room air shows an oxygen saturation of 95%. Physical examination discloses mild subcostal and intercostal retractions. Chest x-ray shows prominent pulmonary vascular markings and fluid in the intralobar fissures. Which of the following diagnoses is most likely and explain your rationale on each choice?";(A) Chlamydial pneumonia (B) Group B streptococcal sepsis (C) Meconium aspiration syndrome (D) Respiratory distress syndrome (E) Transient tachypnea of newborn;E;E;https://openevidence.com/usmle-results/step-3-;Diagnosis Typical Key Risk Clinical Chest X-ray Rationale for/;"Age of Factors Presentation Findings against in this Onset case Chlamydial 1–3 Maternal C. Afebrile, Hyperinflation; Against: [1-2] pneumonia months trachomatis subacute course; bilateral diffuse symptoms at infection staccato cough, interstitial 2 hours of life tachypnea; infiltrates are too early; conjunctivitis; exam lacks peripheral staccato eosinophilia cough/ common conjunctivitis; CXR not interstitial/ hyperinflated Group B Within Maternal Variable: May show Against: infant [3-4] streptococcal first 24–48 GBS tachypnea, pneumonia/ afebrile, well- sepsis hours colonization, grunting, RDS-like diffuse appearing (early- prolonged temperature opacities with mild onset) ROM, instability, distress, prematurity lethargy to normal O2 severe sat, high cardiorespiratory Apgars; CXR failure/PPHN shows vascular congestion/ fissural fluid, not pneumonia Meconium Immediate Meconium- Often moderate– Patchy coarse Against: light [5-11] aspiration to first stained fluid severe distress, bilateral meconium syndrome hours (esp. thick), hypoxemia, may infiltrates, areas only, vigorous after birth fetal have PPHN of at birth Diagnosis Typical Key Risk Clinical Chest X-ray Rationale for/ References Age of Factors Presentation Findings against in this Onset case distress, hyperinflation/ (Apgars 9/9), post-term, atelectasis mild distress low Apgars with normal oxygenation; CXR lacks coarse patchy opacities/ hyperinflation Respiratory Minutes– Prematurity Grunting, Diffuse Against: 36 [6-8, 12-13] distress hours (classically retractions, reticulogranular wks less syndrome after birth <34 wks), cyanosis, “ground-glass” typical; CXR surfactant worsening over with air shows deficiency time bronchograms, prominent low volumes vascular markings and fissural fluid (pulmonary edema), not ground- glass/air bronchograms Transient Within Cesarean Tachypnea with Prominent For: exact [6-8, 12-13] tachypnea of first 2 delivery mild retractions; vascular timing (2 h), [14][15][16] the newborn hours; without O2 sat usually markings, risk factors [17] resolves labor, late >90% on room interlobar (36 wks, C- 24–72 preterm, air; improves fissural fluid, section, male, hours male sex, over 1–3 days mild maternal maternal hyperinflation smoking), smoking mild distress with normal saturations; classic CXR (vascular congestion + fissural fluid) → Most likely diagnosis: Transient Diagnosis Typical Key Risk Clinical Chest X-ray Rationale for/ References Age of Factors Presentation Findings against in this Onset case tachypnea of the newborn References 1. Sexually Transmitted Infections Treatment Guidelines, 2021. Workowski KA, Bachmann LH, Chan PA, et al.. MMWR. Recommendations and Reports : Morbidity and Mortality Weekly Report. Recommendations and Reports. 2021;70(4):1-187. doi:10.15585/mmwr.rr7004a1. 2. Clinical Characteristics of the Afebrile Pneumonia Associated With Chlamydia Trachomatis Infection in Infants Less Than 6 Months of Age. Tipple MA, Beem MO, Saxon EM.. Pediatrics. 1979;63(2):192-7. 3. Management of Infants at Risk for Group B Streptococcal Disease. Puopolo KM, Lynfield R, Cummings JJ.. Pediatrics. 2019;144(2):e20191881. doi:10.1542/ peds.2019-1881. 4. Early-Onset Neonatal Sepsis. Simonsen KA, Anderson-Berry AL, Delair SF, Davies HD.. Clinical Microbiology Reviews. 2014;27(1):21-47. doi:10.1128/ CMR.00031-13. 5. Meconium ""Aspiration"" (Or Respiratory Distress Associated With meconium-Stained Amniotic Fluid?). Vain NE, Batton DG.. Seminars in Fetal & Neonatal Medicine. 2017;22(4):214-219. doi:10.1016/j.siny.2017.04.002. 6. Evidence of Both Foetal Inflammation and Hypoxia-Ischaemia Is Associated With Meconium Aspiration Syndrome. Yokoi K, Iwata O, Kobayashi S, et al.. Scientific Reports. 2021;11(1):16799. doi:10.1038/s41598-021-96275-x. 7. Meconium-Stained Amniotic Fluid. Gallo DM, Romero R, Bosco M, et al.. American Journal of Obstetrics and Gynecology. 2023;228(5S):S1158-S1178. doi:10.1016/j.ajog.2022.11.1283. 8. Meconium Aspiration Syndrome: A Role for Fetal Systemic Inflammation. Lee J, Romero R, Lee KA, et al.. American Journal of Obstetrics and Gynecology. 2016;214(3):366.e1-9. doi:10.1016/j.ajog.2015.10.009. 9. Respiratory Distress of the Term Newborn Infant. Edwards MO, Kotecha SJ, Kotecha S.. Paediatric Respiratory Reviews. 2013;14(1):29-36; quiz 36-7. doi:10.1016/j.prrv.2012.02.002. 10. Respiratory Distress in the Newborn. Hermansen CL, Lorah KN.. American Family Physician. 2007;76(7):987-94. 11. Risk Factors for the Development of Respiratory Distress Syndrome and Transient Tachypnoea in Newborn Infants. Italian Group of Neonatal Pneumology. Dani C, Reali MF, Bertini G, et al.. The European Respiratory Journal. 1999;14(1):155-9. doi:10.1034/j.1399-3003.1999.14a26.x. 12. Newborn Respiratory Distress. Hermansen CL, Mahajan A.. American Family Physician. 2015;92(11):994-1002. 13. Evolution of Ultrasound-Assessed Lung Aeration and Gas Exchange in Respiratory Distress Syndrome and Transient Tachypnea of the Neonate. Pezza L, Sartorius V, Loi B, et al.. The Journal of Pediatrics. 2023;256:44-52.e2. doi:10.1016/j.jpeds.2022.11.037. 14. Lung Ultrasonography to Diagnose Transient Tachypnea of the Newborn. Liu J, Chen XX, Li XW, et al.. Chest. 2016;149(5):1269-75. doi:10.1016/ j.chest.2015.12.024. 15. Interventions for the Management of Transient Tachypnoea of the Newborn - An Overview of Systematic Reviews. Bruschettini M, Hassan KO, Romantsik O, et al.. The Cochrane Database of Systematic Reviews. 2022;2:CD013563. doi:10.1002/14651858.CD013563.pub2. 16. Non-Invasive Respiratory Support for the Management of Transient Tachypnea of the Newborn. Moresco L, Romantsik O, Calevo MG, Bruschettini M.. The Cochrane Database of Systematic Reviews. 2020;4:CD013231. doi:10.1002/14651858.CD013231.pub2. 17. Transient Tachypnea of the Newborn: The Treatment Strategies. Yurdakok M, Ozek E.. Current Pharmaceutical Design. 2012;18(21):3046-9. doi:10.2174/1381612811209023046."
