#;Identificador;Pergunta;Opcoesrespostas;Resposta Correta;Resposta OpenEvidence;Link OpenEvidence;Explicacao OpenEvidence;Referências
217;Question 18.1 (MC-NJ) - Step 3;A 45-year-old man comes to the office for an initial appointment because he would like you to fill out and sign a legal document at the request of his attorney. The patient works as a limousine driver. He states that he is filing a lawsuit against the limousine company that employs him because he developed post- traumatic stress disorder following a motor vehicle collision. He appears irritable and tense as he provides his history. He relays his symptoms by reading them aloud from a written list. At this time, which of the following is the most appropriate approach toward confirming the underlying diagnosis of this patient?;(A) Administer amobarbital and then interview the patient (B) Ask the patient to provide a narrative with detailed description of the incident and of his symptoms (C) Interview the patient under hypnosis (D) Interview the patient while paying close attention to his willingness to make eye contact (E) Tell the patient he is exhibiting behaviors that are suggestive of malingering and see how he responds;B;B;https://openevidence.com/usmle-results/step-3-;"(B) Ask the patient to provide a narrative with a detailed description of the incident and his symptoms The appropriate first step—particularly in a medicolegal context—is an open- ended, detailed narrative of the precipitating event, symptom onset and course, associated functional impairment, and treatment history. This permits assessment of internal consistency, temporal relationship to the trauma, plausibility, and comparison with collateral data without suggesting symptoms or prematurely confronting the evaluee.[1][2] The American Academy of Psychiatry and the Law emphasizes detailed inquiry into exposure, time course, and effects across immediate, medium, and long-term periods, supplemented by collateral records and witness accounts.[1] The American Psychiatric Association recommends beginning with open-ended empathic questioning before structured probes for PTSD criteria and functional impact.[2] Techniques such as amobarbital or hypnosis lack reliability, raise ethical/ forensic concerns, and are not recommended for diagnostic clarification.[1] Nonverbal cues like eye contact are nonspecific and insufficient to confirm diagnosis.[3] Immediate confrontation about malingering is premature; instead, use systematic interviewing, collateral review, and, when indicated, validated instruments (e.g., CAPS, MMPI-2 validity scales) to evaluate response bias and symptom validity in suspected malingering.[4][5]";"1. AAPL Practice Guideline for the Forensic Assessment. Glancy GD, Ash P, Bath EP, et al.. The Journal of the American Academy of Psychiatry and the Law. 2015;43(2 Suppl):S3-53. 2. The American Psychiatric Association Practice Guidelines for the Psychiatric Evaluation of Adults. American Psychiatric Association. 3. Malingering of PTSD: Forensic and Diagnostic Considerations, Characteristics of Malingerers and Clinical Presentations. Hall RC, Hall RC.. General Hospital Psychiatry. 2006 Nov-Dec;28(6):525-35. doi:10.1016/ j.genhosppsych.2006.08.011. 4. Detection of Malingered PTSD: An Overview of Clinical, Psychometric, and Physiological Assessment: Where Do We Stand?. Hall RC, Hall RC.. Journal of Forensic Sciences. 2007;52(3):717-25. doi:10.1111/j.1556-4029.2007.00434.x. 5. Does This Patient Have Posttraumatic Stress Disorder?Rational Clinical Examination Systematic Review. Spoont MR, Williams JW, Kehle-Forbes S, et al.. JAMA. 2015;314(5):501-10. doi:10.1001/jama.2015.7877."
218;Question 19.1 (MC-NJ) - Step 3;"A 39-year-old woman comes to the office because of gradually increasing shortness of breath while doing her usual household activities. She also reports fatigue, a feeling of heaviness in her chest with exertion, trouble sleeping, and the very recent onset of a rapid heart beat and fluttering in her chest. She says, ""I was always sick as a child."" She does not smoke cigarettes, and she is not currently taking any medications other than occasional aspirin. Her father died of a myocardial infarction at age 55 years. She is married and has two teenaged children. She did have some shortness of breath at the end of her second pregnancy. Physical examination today shows a thin woman with an irregular pulse of 130/min. Thyroid gland is normal to palpation. There is a prominent diastolic rumble heard best over the apical area of her heart. Lungs are clear; there is no hepatomegaly or pretibial edema. Which of the following is the most helpful diagnostic study at this time?";(A) Chest x-ray (B) ECG (C) Serum anti-streptolysin O titer (D) Serum C-reactive protein concentration (E) Serum thyroid-stimulating hormone (TSH) concentration;B;B;https://openevidence.com/usmle-results/step-3-;"Electrocardiogram (ECG) (B) The presentation—progressive exertional dyspnea, fatigue, palpitations with an irregular tachycardia, and a low-pitched apical diastolic rumble—is classic for rheumatic mitral stenosis complicated by new-onset atrial fibrillation (AF). In this setting, the most immediately helpful diagnostic study is an ECG to confirm AF, characterize ventricular response, and guide urgent rate/rhythm control and anticoagulation decisions.[1] The American College of Cardiology/American Heart Association/Heart Rhythm Society emphasizes ECG as the first step in evaluating suspected AF and that transthoracic echocardiography (TTE) should follow promptly to define valve anatomy, severity, and pulmonary pressures.[1][2] [3] • TTE is the definitive test to confirm and quantify rheumatic mitral stenosis and assess suitability for intervention, and should be obtained expeditiously after ECG confirmation of AF. [2][3] • Chest x-ray, anti-streptolysin O titer, C-reactive protein, and TSH do not provide the immediate arrhythmia diagnosis needed to direct acute management in this scenario. Practical next steps after ECG confirms AF: • Initiate rate control and anticoagulation assessment; in rheumatic MS with AF, anticoagulation with a vitamin K antagonist is indicated rather than a DOAC (per prevailing U.S. practice standards; dosing is individualized and not requested here). • Obtain urgent TTE to quantify mitral valve area, mean gradient, pulmonary pressures, and valve morphology to guide definitive therapy. [2][3] This sequence aligns with the American College of Cardiology/American Heart Association guidance for both AF evaluation and rheumatic mitral stenosis assessment.[1][2][3][4]";"1. 2023 ACC/AHA/ACCP/HRS Guideline for the Diagnosis and Management of Atrial Fibrillation: A Report of the American College of Cardiology/ American Heart Association Joint Committee on Clinical Practice Guidelines. Joglar JA, Chung MK, Armbruster AL, et al.. Circulation. 2024;149(1):e1-e156. doi:10.1161/CIR.0000000000001193. 2. 2020 ACC/AHA Guideline for the Management of Patients With Valvular Heart Disease: A Report of the American College of Cardiology/ American Heart Association Joint Committee on Clinical Practice Guidelines. Otto CM, Nishimura RA, Bonow RO, et al.. Journal of the American College of Cardiology. 2021;77(4):e25-e197. doi:10.1016/ j.jacc.2020.11.018. 3. 2014 AHA/ACC Guideline for the Management of Patients With Valvular Heart Disease: A Report of the American College of Cardiology/American Heart Association Task Force on Practice Guidelines. Nishimura RA, Otto CM, Bonow RO, et al.. Journal of the American College of Cardiology. 2014;63(22):e57-185. doi:10.1016/j.jacc.2014.02.536. 4. Recommendations for the Use of Echocardiography in the Evaluation of Rheumatic Heart Disease: A Report From the American Society of Echocardiography. Pandian NG, Kim JK, Arias-Godinez JA, et al.. Journal of the American Society of Echocardiography : Official Publication of the American Society of Echocardiography. 2023;36(1):3-28. doi:10.1016/ j.echo.2022.10.009."
219;Question 20.1 (MC-NJ) - Step 3;"A 10-year-old boy with a traumatic brain injury sustained during infancy is examined in the nursing care facility where he resides because he has had no urine output during the past 24 hours. During the past 4 days, he has had decreasing urine output, intermittent fever, rhinorrhea, and cough. As a result of his brain injury, the patient has severe developmental delay and a seizure disorder. He is fed orally, but he is nonverbal and nonambulatory. Medications are levetiracetam, docusate, and multivitamins. The patient is 131 cm (4 ft 2 in; 10th percentile) tall and weighs 26 kg (57 lb; 10th percentile). BMI is 14 kg/m² (10th percentile). Vital signs are temperature 38.8°C (101.8°F), pulse 80/min, respirations 25/min, and blood pressure 110/80 mm Hg. Pulse oximetry on room air shows an oxygen saturation of 95%. The patient appears thin. He is awake and is not in apparent distress. He is responsive to touch. Auscultation of the lungs discloses scattered coarse crackles and rhonchi but good air entry and normal work of breathing. Results of laboratory studies are shown: Serum Blood Urea nitrogen 78 mg/dL Creatinine 3.2 mg/dL Na+ 131 mEq/L K+ 5.6 mEq/L Cl− 88 mEq/L HCO³ −16 mEq/L Urine Specific gravity 1.030 (N=1.003–1.029) Creatinine 90 mg/dL Na+ 8 mEq/L Hematocrit 37% Hemoglobin 12.5 g/dL WBC 12,000/mm3 Neutrophils, segmented 60% Lymphocytes 40% Platelet count 250,000/mm3 Which of the following is the most likely cause of this patient's altered kidney function?";(A) Acute tubular necrosis (B) Decreased intravascular volume (C) Medication-related interstitial nephritis (D) Neurogenic bladder (E) Pyelonephritis;B;B;https://openevidence.com/usmle-results/step-3-;"FENa[1] is indicated for differentiating between prerenal azotemia and acute tubular necrosis (ATN) in patients with acute kidney injury (AKI).[1][2] It is particularly useful in oliguric patients and less reliable in those with chronic kidney disease (CKD) or on diuretics.[2][3] Computed value for Fractional Excretion of Sodium: 0.22 % FENa ≤ 1%: Suggests prerenal causes. A FENa of less than or equal to 1% typically indicates prerenal azotemia, such as volume depletion or hepatorenal syndrome. [1][3] However, its specificity is low in certain conditions like cirrhosis, and it may be affected by diuretic use, making it less reliable in these contexts.[2][3][4] Formula For Calculating: FENa (Fractional Excretion of Sodium)[1] [ \text{FENa (\%)} = 100 \times \frac{\text{Serum Creatinine} \, (\text{mg/dL}) \times \text{Urine Sodium} \, (\text{mEq/L})}{\text{Serum Sodium} \, (\text{mEq/L}) \times \text{Urine Creatinine} \, (\text{mg/dL})} ] Decreased intravascular volume Severe oligo-anuric AKI with a very concentrated urine (specific gravity 1.030), low urine sodium (8 mEq/L), and FENa 0.22% strongly indicates intact tubular sodium and water reabsorption consistent with prerenal azotemia from hypovolemia. The Kidney Disease: Improving Global Outcomes (KDIGO) guideline notes that oliguria with high urine concentration and low urine sodium reflects preserved tubular function; in the appropriate clinical context this supports decreased effective circulating volume.[5] Classic urinary indices (low UNa, high U/P creatinine, FENa <1%) favor prerenal AKI over ATN in oliguric, non–diuretic-treated patients.[2][6] The BUN/Cr ratio here (~24) further supports a prerenal picture.[7] Alternative choices are less likely: • Acute tubular necrosis typically shows impaired concentration with higher UNa and FENa (>1–2%) or isosthenuria, which are not present.[2][6] • Medication-related interstitial nephritis is usually nonoliguric and associated with hypersensitivity features and pyuria; the current medication list is not typical for AIN.[8][9][10] • Neurogenic bladder (postrenal) more often produces isotonic urine and higher UNa; diagnosis is supported by bladder distention/postvoid residual, not suggested here.[7][11] • Pyelonephritis generally presents with pyuria/bacteriuria and does not typically cause anuric AKI; none of these features are provided.[12][13] Immediate management focuses on isotonic crystalloid volume repletion with close monitoring of urine output, creatinine, and electrolytes, while addressing the precipitating febrile respiratory illness and avoiding nephrotoxins; reassess after a fluid challenge and evaluate for obstruction if no response (e.g., bladder catheterization/ultrasound).[5][7]";"1. The FENa Test. Use in the Differential Diagnosis of Acute Renal Failure. Espinel CH.. Jama. 1976;236(6):579-81. doi:10.1001/jama.236.6.579. 2. Diagnostic Performance of Fractional Excretion of Sodium for the Differential Diagnosis of Acute Kidney Injury: A Systematic Review and Meta-Analysis. Abdelhafez M, Nayfeh T, Atieh A, et al.. Clinical Journal of the American Society of Nephrology : CJASN. 2022;17(6):785-797. doi:10.2215/ CJN.14561121. 3. AGA Clinical Practice Update on the Evaluation and Management of Acute Kidney Injury in Patients With Cirrhosis: Expert Review. Flamm SL, Wong F, Ahn J, Kamath PS.. Clinical Gastroenterology and Hepatology : The Official Clinical Practice Journal of the American Gastroenterological Association. 2022;20(12):2707-2716. doi:10.1016/j.cgh.2022.08.033. 4. Fractional Excretion of Sodium in Hepatorenal Syndrome: Clinical and Pathological Correlation. Alsaad AA, Wadei HM.. World Journal of Hepatology. 2016;8(34):1497-1501. doi:10.4254/wjh.v8.i34.1497. 5. 2012 Clinical Practice Guideline for Acute Kidney Injury. Katrin Uhlig, Jose Calvo-Broce, Ancet Deo, Amy Earley, Ethan M Balk. Kidney Disease: Improving Global Outcomes 6. Urinary Diagnostic Indices in Acute Renal Failure: A Prospective Study. Miller TR, Anderson RJ, Linas SL, et al.. Annals of Internal Medicine. 1978;89(1):47-50. doi:10.7326/0003-4819-89-1-47. 7. Pre- And Postoperative Renal Failure. Dornfeld L, Narins RG.. The Urologic Clinics of North America. 1976;3(2):363-77. 8. Facing the Challenge of Drug-Induced Acute Interstitial Nephritis. Sanchez-Alamo B, Cases-Corona C, Fernandez-Juarez G.. Nephron. 2023;147(2):78-90. doi:10.1159/000525561. 9. Acute Interstitial Nephritis. Praga M, González E.. Kidney International. 2010;77(11):956-61. doi:10.1038/ki.2010.89. 10. Changes in the Aetiology, Clinical Presentation and Management of Acute Interstitial Nephritis, an Increasingly Common Cause of Acute Kidney Injury. Praga M, Sevillano A, Auñón P, González E.. Nephrology, Dialysis, Transplantation : Official Publication of the European Dialysis and Transplant Association - European Renal Association. 2015;30(9):1472-9. doi:10.1093/ndt/gfu326. 11. The Urological Evaluation and Management of Neurogenic Bladder in Children and Adolescents-What Every Pediatric Nephrologist Needs to Know. Brownrigg N, Lorenzo AJ, Rickard M, Dos Santos J.. Pediatric Nephrology (Berlin, Germany). 2024;39(2):409-421. doi:10.1007/ s00467-023-06064-z. 12. Clinical Manifestations, Laboratory Markers, and Renal Ultrasonographic Examinations in 1-Month to 12-Year-Old Iranian Children With Pyelonephritis: A Six-Year Cross-Sectional Retrospective Study. Fahimi D, Khedmat L, Afshin A, et al.. BMC Infectious Diseases. 2021;21(1):189. doi:10.1186/s12879-021-05887-1. 13. Clinical Differentiation of Acute Pyelonephritis From Lower Urinary Tract Infection in Children. Huang DT, Huang FY, Tsai TC, et al.. Journal of Microbiology, Immunology, and Infection = Wei Mian Yu Gan Ran Za Zhi. 2007;40(6):513-7."
220;Question 22.1 (MC-NJ) - Step 3;"A 27-year-old man comes to the office with his wife because of a recent episode of loss of muscle control. He says, ""I was at a reception, someone told a joke, and when I laughed, my legs collapsed!"" His wife says that he recovered in a few seconds and he did not lose consciousness. He has a long history of sleepiness and he is able to go to sleep quickly. He usually awakens feeling refreshed after a short nap. He has no history of similar episodes or hallucinations. There is no family history of similar problems. Vital signs are normal. Physical examination shows no abnormalities. Which of the following is the most likely diagnosis?";(A) Narcolepsy (B) Primary hypersomnia (C) A seizure disorder (D) Sleep paralysis (E) Vasovagal syndrome;A;A;https://openevidence.com/usmle-results/step-3-;"The most likely diagnosis is: Narcolepsy. The episode is classic cataplexy: brief, emotion-triggered loss of muscle tone with preserved consciousness and rapid recovery. Cataplexy is pathognomonic for narcolepsy type 1. The background of chronic excessive daytime sleepiness with short, refreshing naps further supports narcolepsy and helps distinguish it from primary hypersomnia, in which naps are typically long and unrefreshing and cataplexy is absent.[1][2][3][4][5][6][7][8][9] Seizure disorders and vasovagal syncope usually involve loss of consciousness and post-event confusion or fatigue, and are not typically triggered by positive emotions; sleep paralysis occurs at sleep–wake transitions and is not an emotion-triggered atonia during wakefulness.[1][10][11][12] To illustrate the pathognomonic feature anchoring this diagnosis, the figure below depicts cataplexy: sudden, emotionally triggered muscle weakness with preserved awareness, evolving over seconds and resolving within minutes— matching this vignette.[1] Figure 1. Cataplexy. Used under license from The New England Journal of Medicine. Practical diagnostic next steps (if pursued): overnight polysomnography followed by MSLT demonstrating mean sleep latency ≤8 minutes with ≥2 SOREMPs, or CSF hypocretin-1 deficiency; DSM-5-TR criteria require recurrent daytime sleep episodes ≥3 times/week for ≥3 months plus cataplexy, hypocretin deficiency, or characteristic polysomnography/MSLT findings.[4][8] Differential features arguing against alternatives: lack of LOC/postictal state (seizure/syncope) and absence of sleep–wake transition timing (sleep paralysis).[10][12]";"1. Narcolepsy. Scammell TE.. The New England Journal of Medicine. 2015;373(27):2654-62. doi:10.1056/NEJMra1500587. 2. Narcolepsy. National Library of Medicine (MedlinePlus). 3. Narcolepsy With Cataplexy. Dauvilliers Y, Arnulf I, Mignot E.. Lancet (London, England). 2007;369(9560):499-511. doi:10.1016/ S0140-6736(07)60237-2. 4. Diagnostic and Statistical Manual of Mental Disorders. Dilip V. Jeste, Jeffrey A. Lieberman, David Fassler, et al. American Psychiatric Association (2022) 5. Cataplexy--Clinical Aspects, Pathophysiology and Management Strategy. Dauvilliers Y, Siegel JM, Lopez R, Torontali ZA, Peever JH.. Nature Reviews. Neurology. 2014;10(7):386-95. doi:10.1038/nrneurol.2014.97. 6. The Clinical Characteristics of Cataplectic Attack in Narcolepsy Type 1. Huang B, Xu T, Wang Z, et al.. Sleep Medicine. 2021;77:261-269. doi:10.1016/ j.sleep.2019.03.015. 7. Diagnostic Aspects of Narcolepsy. Aldrich MS.. Neurology. 1998;50(2 Suppl 1):S2-7. doi:10.1212/wnl.50.2_suppl_1.s2. 8. Excessive Daytime Sleepiness: A Clinical Review. Gandhi KD, Mansukhani MP, Silber MH, Kolla BP.. Mayo Clinic Proceedings. 2021;96(5):1288-1301. doi:10.1016/j.mayocp.2020.08.033. 9. Understanding and Approaching Excessive Daytime Sleepiness. Pérez- Carbonell L, Mignot E, Leschziner G, Dauvilliers Y.. Lancet (London, England). 2022;400(10357):1033-1046. doi:10.1016/S0140-6736(22)01018-2. 10. Initial Management of Seizure in Adults. Smith PEM.. The New England Journal of Medicine. 2021;385(3):251-263. doi:10.1056/NEJMcp2024526. 11. Approach to Loss of Consciousness: Distinguishing Epileptic Seizures, Psychogenic Nonepileptic Seizures, and Syncope. Ebong I, Haghighat Z, Bensalem-Owen M.. Seminars in Neurology. 2021;41(6):667-672. doi:10.1055/ s-0041-1726359. 12. Did This Patient Have Cardiac Syncope?The Rational Clinical Examination Systematic Review. Albassam OT, Redelmeier RJ, Shadowitz S, et al.. JAMA. 2019;321(24):2448-2457. doi:10.1001/jama.2019.8001."
221;Question 23.1 (MC-NJ) - Step 3;A study is being conducted to assess mesothelioma in shipyard workers. A large shipyard firm has provided the asbestos exposure records of all employees during the past 50 years. The health insurer for the workers has provided claims data that documents all chest x-rays and diagnoses of mesothelioma among current workers and retirees. The study enrolled shipyard workers who were diagnosed with mesothelioma and shipyard workers who were not diagnosed with mesothelioma. All subjects in the study had to have chest x‐rays. Which of the following is the best rationale for selecting a comparison group that had chest x-rays?;(A) Address confounding (B) Demonstrate causality (C) Minimize ascertainment bias (D) Reduce recall bias ;C;C;https://openevidence.com/usmle-results/step-3-;"(C) Minimize ascertainment bias Requiring chest x-rays for both cases and controls equalizes diagnostic opportunity, reducing detection/ascertainment bias—i.e., systematic differences in outcome identification due to differential surveillance or screening intensity between groups. In occupational cohorts, workers who undergo more imaging are more likely to have mesothelioma detected; restricting comparison subjects to those who also had chest imaging helps ensure comparability in outcome ascertainment and avoids spurious associations driven by differential case finding rather than true disease risk.[1][2][3] Similar concerns are well-described in studies where prior screening (e.g., chest x-ray) alters case detection probabilities and biases observed associations if not accounted for.[1][4] • Confounding (A) involves third variables associated with exposure and outcome and is addressed by design/analysis (restriction, matching, stratification, multivariable adjustment), not by requiring imaging.[2][3] • Demonstrating causality (B) cannot be accomplished by this design feature alone. • Recall bias (D) pertains to differential accuracy in self-reported exposure; using insurer claims and employer records already mitigates recall issues, and mandating x-rays does not specifically address recall bias.[3][5]";"1. A Mathematical Model of Case-Ascertainment Bias: Applied to Case- Control Studies Nested Within a Randomized Screening Trial. Jansen RJ, Alexander BH, Hayes RB, et al.. PloS One. 2018;13(3):e0194608. doi:10.1371/ journal.pone.0194608. 2. Bias and Causal Associations in Observational Research. Grimes DA, Schulz KF.. Lancet (London, England). 2002;359(9302):248-52. doi:10.1016/ S0140-6736(02)07451-2. 3. Bias, Confounding, and Interaction: Lions and Tigers, and Bears, Oh My!. Vetter TR, Mascha EJ.. Anesthesia and Analgesia. 2017;125(3):1042-1048. doi:10.1213/ANE.0000000000002332. 4. An Evaluation of Chest X-Ray Screening for Lung Cancer in Gunma Prefecture, Japan: A Population-Based Case-Control Study. Nakayama T, Baba T, Suzuki T, Sagawa M, Kaneko M.. European Journal of Cancer (Oxford, England : 1990). 2002;38(10):1380-7. doi:10.1016/ s0959-8049(02)00083-7. 5. Differential Recall Bias and Spurious Associations in Case/Control Studies. Barry D.. Statistics in Medicine. 1996;15(23):2603-16. doi:10.1002/ (SICI)1097-0258(19961215)15:23<2603::AID-SIM371>3.0.CO;2-G."
