#;Identificador;Pergunta;Opcoesrespostas;Resposta Correta;Resposta OpenEvidence;Link OpenEvidence;Explicacao OpenEvidence;Referências
237;Question 40.1 (MC-NJ) - Step 3;"A 67-year-old man, who has been recovering in the hospital following surgical repair of a contained ruptured abdominal aortic aneurysm 10 days ago, suddenly develops severe abdominal pain. He does not have chest pain or shortness of breath. The patient's postoperative course had been uncomplicated until 4 days ago, when he developed a low-grade fever. He has been unable to tolerate a full liquid diet during the past 4 days. Medical history is remarkable for hypertension, hypercholesterolemia, and a myocardial infarction 6 years ago. Regular medications include metoprolol, lovastatin, and an 81-mg aspirin daily. He has smoked one pack of cigarettes daily for the past 40 years, and he typically drinks three to five beers daily. Vital signs now are temperature 38.1°C (100.6°F), pulse 68/min and regular, respirations 16/min, and blood pressure 150/90 mm Hg. Physical examination shows bilateral cataracts. Auscultation of the chest discloses diffuse mild wheezes and a grade 1/6 soft systolic ejection murmur at the cardiac apex. Palpation of the abdomen discloses mild to moderate mid and right upper quadrant abdominal tenderness. There is no guarding, rebound, or palpable mass. Rectal examination shows no abnormalities. Peripheral pulses are normal. Neurologic examination discloses no abnormalities. Serum electrolyte concentrations are within the reference ranges. Leukocyte count is 15,800/mm³ with mild left shift. Urinalysis shows no abnormalities. ECG shows an old inferior myocardial infarction. Chest x-ray shows scarring at the left and right cardiac bases; no masses or infiltrates are present. Which of the following is the most appropriate additional diagnostic study?";(A) Arteriography of the abdomen (B) Blood cultures (C) MRI of the abdomen (D) Ultrasonography of the abdomen (E) No additional studies are needed;D;D;https://openevidence.com/usmle-results/step-3-;"Ultrasonography of the abdomen (D) This postoperative patient 10 days after open AAA repair presents with new severe abdominal pain, persistent low-grade fever, leukocytosis, intolerance of oral intake, and focal RUQ tenderness without peritonitis. The differential in this context includes postoperative acalculous cholecystitis, ischemic colitis, graft infection/mycotic aneurysm, and aortoenteric fistula.[1][2][3][4] Given the RUQ localization and systemic inflammation, acalculous cholecystitis is a common postoperative complication after major vascular surgery and is best evaluated initially with RUQ ultrasonography due to its rapid availability and good diagnostic performance for gallbladder pathology; when equivocal, HIDA is the confirmatory test.[5][6][7] While contrast-enhanced CT angiography is the first-line modality for undifferentiated acute abdomen and for suspected vascular or graft complications, the clinical picture here most strongly suggests biliary pathology, making ultrasound the most appropriate next study.[1][2] Arteriography is not an initial diagnostic test in this setting.[8] MRI is slower and not first-line for acute RUQ pain.[5][6] Blood cultures may be obtained if sepsis is suspected but will not localize the source and are not a substitute for imaging. If ultrasound is nondiagnostic or suggests alternative pathology, escalate to contrast-enhanced CT angiography of the abdomen/pelvis to evaluate for ischemic colitis or graft-related complications.[1][2][4]";"1. Acute Abdomen in the Modern Era. Rogers SO, Kirton OC.. The New England Journal of Medicine. 2024;391(1):60-67. doi:10.1056/ NEJMra2304821. 2. Vascular Graft Infections, Mycotic Aneurysms, and Endovascular Infections: A Scientific Statement From the American Heart Association. Wilson WR, Bower TC, Creager MA, et al.. Circulation. 2016;134(20):e412- e460. doi:10.1161/CIR.0000000000000457. 3. ACG Clinical Guideline: Epidemiology, Risk Factors, Patterns of Presentation, Diagnosis, and Management of Colon Ischemia (CI). Brandt LJ, Feuerstadt P, Longstreth GF, Boley SJ.. The American Journal of Gastroenterology. 2015;110(1):18-44; quiz 45. doi:10.1038/ajg.2014.395. 4. ACR Appropriateness Criteria® Pulsatile Abdominal Mass, Suspected Abdominal Aortic Aneurysm: 2023 Update. Wang DS, Shen J, Majdalany BS, et al.. Journal of the American College of Radiology : JACR. 2023;20(11S):S513-S520. doi:10.1016/j.jacr.2023.08.010. 5. Acute Cholecystitis: A Review. Gallaher JR, Charles A.. JAMA. 2022;327(10):965-975. doi:10.1001/jama.2022.2350. 6. A Systematic Review and Meta-Analysis of Diagnostic Performance of Imaging in Acute Cholecystitis. Kiewiet JJ, Leeuwenburgh MM, Bipat S, et al.. Radiology. 2012;264(3):708-20. doi:10.1148/radiol.12111561. 7. Is Hepato-Imino Diacetic Acid Scan a Better Imaging Modality Than Abdominal Ultrasound for Diagnosing Acute Cholecystitis?. Kaoutzanis C, Davies E, Leichtle SW, et al.. American Journal of Surgery. 2015;210(3):473-82. doi:10.1016/j.amjsurg.2015.03.005. 8. Aortic Fistulas: Pathophysiologic Features, Imaging Findings, and Diagnostic Pitfalls. Gulati A, Kapoor H, Donuru A, Gala K, Parekh M.. Radiographics : A Review Publication of the Radiological Society of North America, Inc. 2021 Sep-Oct;41(5):1335-1351. doi:10.1148/rg.2021210004."
238;Question 42.1 (MC-NJ) - Step 3;"A 31-year-old woman, gravida 3, para 2, who is at 32 weeks' gestation, is admitted to the hospital because of a 1-week history of progressive dyspnea and wheezing. She says her heart is ""racing"" and she is coughing up a small amount of blood-streaked sputum. Medical history is significant for hypothyroidism, for which she takes levothyroxine. An intravenous catheter is placed. Vital signs are temperature 36.9°C (98.4°F), pulse 132/min, respirations 32/min, and blood pressure 135/78 mm Hg. Pulse oximetry on 100% oxygen via nasal cannula shows an oxygen saturation of 92%. Auscultation of the lungs discloses decreased breath sounds at the bases with expiratory crackles bilaterally. Cardiac examination discloses an irregularly irregular rhythm, an indistinct point of maximal impulse, and a loud S1. A grade 3/6, low-pitched, diastolic, rumbling murmur is audible at the apex; a distinct snapping sound precedes the murmur. Fetal heart rate is 144/min. Which of the following is the most likely cause of the findings in this patient?";(A) Atrial septal defect with development of pulmonary hypertension (B) Chronic mitral regurgitation secondary to rheumatic heart disease (C) Coarctation of the aorta (D) Congenital aortic stenosis (E) Mitral stenosis complicated by atrial fibrillation;E;E;https://openevidence.com/usmle-results/step-3-;"Mitral stenosis complicated by atrial fibrillation The presentation is classic for severe rheumatic mitral stenosis decompensating in late pregnancy: loud S1, diastolic low-pitched rumble at the apex with an opening snap, irregularly irregular rhythm (atrial fibrillation), pulmonary edema (crackles, hypoxemia despite oxygen), and hemoptysis. Pregnancy-induced increases in blood volume and heart rate exacerbate transmitral gradients and left atrial pressure, precipitating pulmonary venous hypertension, atrial arrhythmias, and heart failure in previously compensated MS.[1][2][3][4] The American Heart Association emphasizes left-sided stenotic lesions—especially rheumatic MS—as among the highest-risk valvular pathologies in pregnancy, with AF and pulmonary edema as typical complications.[1][4] Echocardiography- based pathophysiology in rheumatic MS explains dyspnea and hemoptysis via elevated left atrial and pulmonary venous pressures, worsened by tachycardia/ AF that shortens diastolic filling time.[2] Alternatives are less likely: • ASD with pulmonary hypertension typically causes right-sided chamber enlargement/murmurs rather than a classic apical diastolic rumble with opening snap; pregnancy is generally tolerated without severe hypoxemia unless advanced pulmonary vascular disease is present.[5][6][7][8] • Chronic MR produces a holosystolic apical murmur and is relatively better tolerated in pregnancy compared with stenosis.[1][3] • Coarctation and congenital aortic stenosis do not explain the apical diastolic rumble with opening snap or hemoptysis/pulmonary edema pattern. This scenario aligns most closely with severe rheumatic MS with AF in pregnancy, a high-risk state associated with heart failure and maternal morbidity.[1][3][4]";"1. Cardiovascular Considerations in Caring for Pregnant Patients: A Scientific Statement From the American Heart Association. Mehta LS, Warnes CA, Bradley E, et al.. Circulation. 2020;141(23):e884-e903. doi:10.1161/ CIR.0000000000000772. 2. Recommendations for the Use of Echocardiography in the Evaluation of Rheumatic Heart Disease: A Report From the American Society of Echocardiography. Pandian NG, Kim JK, Arias-Godinez JA, et al.. Journal of the American Society of Echocardiography : Official Publication of the American Society of Echocardiography. 2023;36(1):3-28. doi:10.1016/ j.echo.2022.10.009. 3. Acute Respiratory Failure in Pregnancy. Lapinsky SE, Vasquez DN.. Critical Care Clinics. 2024;40(2):353-366. doi:10.1016/j.ccc.2024.01.005. 4. Pregnancy in Adults With Repaired/Unrepaired Atrial Septal Defect. Bredy C, Mongeon FP, Leduc L, Dore A, Khairy P.. Journal of Thoracic Disease. 2018;10(Suppl 24):S2945-S2952. doi:10.21037/jtd.2017.10.130. 5. Pregnancy Outcomes in Women With Rheumatic Mitral Valve Disease: Results From the Registry of Pregnancy and Cardiac Disease. van Hagen IM, Thorne SA, Taha N, et al.. Circulation. 2018;137(8):806-816. doi:10.1161/ CIRCULATIONAHA.117.032561. 6. Contemporary Diagnosis and Management of Rheumatic Heart Disease: Implications for Closing the Gap: A Scientific Statement From the American Heart Association. Kumar RK, Antunes MJ, Beaton A, et al.. Circulation. 2020;142(20):e337-e357. doi:10.1161/CIR.0000000000000921. 7. Acute Pulmonary Oedema in Pregnant Women. Dennis AT, Solnordal CB.. Anaesthesia. 2012;67(6):646-59. doi:10.1111/j.1365-2044.2012.07055.x. 8. Guidelines for the Echocardiographic Assessment of Atrial Septal Defect and Patent Foramen Ovale: From the American Society of Echocardiography and Society for Cardiac Angiography and Interventions. Silvestry FE, Cohen MS, Armsby LB, et al.. Journal of the American Society of Echocardiography : Official Publication of the American Society of Echocardiography. 2015;28(8):910-58. doi:10.1016/j.echo.2015.05.015."
239;Question 43.1 (MC-NJ) - Step 3;A 70-year-old man is admitted to the hospital through the emergency department because of a 12-hour history of severe nausea and four episodes of vomiting of undigested food. During the past week, he has had worsening nausea, heartburn following meals, and early satiety. Medical history is significant for type 2 diabetes mellitus diagnosed 20 years ago, hyperlipidemia, and hypertension. Medications are intermediate-acting insulin twice daily and insulin lispro before meals. He also takes enalapril and atorvastatin. On admission, the patient appears uncomfortable. Vital signs are temperature 36.2°C (97.1°F), pulse 102/min, respirations 16/min, and blood pressure 105/78 mm Hg. Pulse oximetry on room air shows an oxygen saturation of 98%. Physical examination discloses mild epigastric tenderness to palpation. The remainder of the examination discloses no abnormalities. Results of laboratory studies ordered in the emergency department are shown: Serum Blood ALT 23 U/L AST 26 U/L Alkaline phosphatase 85 U/L Amylase 104 U/L Urea nitrogen 42 mg/dL Creatinine 1.32 mg/dL Hemoglobin A1c 8.2% X-rays of the chest and abdomen disclose no abnormalities. Which of the following will best explain the patient's condition?;(A) Accumulation of calcium carbonate and hemoglobin breakdown products in the bile ducts (B) Decreased gastric myoelectrical activity (C) Decreased gastric pH (D) Increased cholecystokinin activity ;B;B;https://openevidence.com/usmle-results/step-3-;"The best explanation is Decreased gastric myoelectrical activity (B). This presentation is classic for diabetic gastroparesis: subacute worsening of early satiety, postprandial fullness/heartburn, and vomiting of undigested food in a patient with long-standing diabetes and no mechanical obstruction on imaging. Gastroparesis is defined as delayed gastric emptying without obstruction and is strongly associated with these symptoms and poor glycemic control.[1][2][3][4][5] The American College of Gastroenterology and the American Diabetes Association emphasize diagnosis with gastric emptying studies after excluding obstruction.[1][6] Pathophysiology in diabetes centers on gastric neuromuscular dysfunction with impaired myoelectrical activity and antral hypomotility due to autonomic (vagal) neuropathy, injury/dysfunction of interstitial cells of Cajal, and smooth muscle abnormalities, often exacerbated by hyperglycemia; these mechanisms slow gastric emptying and produce the symptom constellation described.[2][3][4][7] Why other options are incorrect: • (A) Describes choledocholithiasis/pigment or mixed gallstones; this does not explain vomiting of undigested food and early satiety with normal radiographs.[5] • (C) Decreased gastric pH is not a primary mechanism of gastroparesis and would not account for delayed emptying.[3][4] • (D) Increased cholecystokinin inhibits gastric emptying by reducing antral motility, but the patient’s syndrome is best attributed to diabetes-related neuromuscular dysfunction rather than isolated hormonal excess; moreover, CCK’s effect is inhibitory rather than causative of the underlying neuropathic disorder.[8][9][10]";"1. ACG Clinical Guideline: Gastroparesis. Camilleri M, Kuo B, Nguyen L, et al.. The American Journal of Gastroenterology. 2022;117(8):1197-1220. doi:10.14309/ajg.0000000000001874. 2. Diabetic Gastroparesis. Bharucha AE, Kudva YC, Prichard DO.. Endocrine Reviews. 2019;40(5):1318-1352. doi:10.1210/er.2018-00161. 3. Gastroparesis: A Turning Point in Understanding and Treatment. Grover M, Farrugia G, Stanghellini V.. Gut. 2019;68(12):2238-2250. doi:10.1136/ gutjnl-2019-318712. 4. Diabetic Gastroparesis: An Overview of Pathogenesis, Clinical Presentation and Novel Therapies, With a Focus on Ghrelin Receptor Agonists. Petri M, Singh I, Baker C, Underkofler C, Rasouli N.. Journal of Diabetes and Its Complications. 2021;35(2):107733. doi:10.1016/j.jdiacomp.2020.107733. 5. 12. Retinopathy, Neuropathy, and Foot Care: Standards of Care in Diabetes-2025. . Diabetes Care. 2025;48(Supplement_1):S252-S265. doi:10.2337/dc25-S012. 6. Gastric Emptying Abnormalities in Diabetes Mellitus. Goyal RK.. The New England Journal of Medicine. 2021;384(18):1742-1751. doi:10.1056/ NEJMra2020927. 7. Diabetic Gastropathy: Gastric Neuromuscular Dysfunction in Diabetes Mellitus: A Review of Symptoms, Pathophysiology, and Treatment. Koch KL.. Digestive Diseases and Sciences. 1999;44(6):1061-75. doi:10.1023/ a:1026647417465. 8. Inhibition of Gastric Emptying Is a Physiological Action of Cholecystokinin. Debas HT, Farooq O, Grossman MI.. Gastroenterology. 1975;68(5 Pt 1):1211-7. 9. Role of Cholecystokinin in the Regulation of Liquid Gastric Emptying and Gastric Motility in Humans: Studies With the CCK Antagonist Loxiglumide. Schwizer W, Borovicka J, Kunz P, et al.. Gut. 1997;41(4):500-4. doi:10.1136/ gut.41.4.500. 10. Advances in the Physiology of Gastric Emptying. Goyal RK, Guo Y, Mashimo H.. Neurogastroenterology and Motility. 2019;31(4):e13546. doi:10.1111/ nmo.13546."
240;Question 44.1 (MC-NJ) - Step 3;A 70-year-old woman comes to the office for an annual health maintenance examination. She describes a 1-year history of slowly progressive fatigue, diffuse muscle aches, and generalized pain. Medical history is significant for osteoporosis diagnosed 5 years ago. Medications include alendronate and calcium supplementation. Vital signs are normal. Physical examination is unremarkable for her age, with no point tenderness on palpation. Results of complete blood count, serum electrolyte and thyroid-stimulating hormone concentrations, liver function tests, and erythrocyte sedimentation rate are all within the reference ranges. Screening mammography and colonoscopy done 1 year ago disclosed no abnormalities. Which of the following is the most appropriate next step in evaluation?;(A) DEXA scan (B) Electromyography and nerve conduction studies (C) MRI of the cervical spine (D) Serum antinuclear antibody assay (E) Serum 25-hydroxyvitamin D assay (F) No additional evaluation is indicated;E;E;https://openevidence.com/usmle-results/step-3-;"The most appropriate next step is to obtain a serum 25-hydroxyvitamin D assay (E). Vitamin D deficiency is prevalent in older adults, can present with nonspecific fatigue and diffuse myalgias, and is particularly relevant in a patient with osteoporosis on bisphosphonate therapy; guidelines from the American Association of Clinical Endocrinology recommend measuring 25(OH)D as part of the laboratory evaluation in women with osteoporosis, and major reviews emphasize checking 25(OH)D in those with bone disease and musculoskeletal symptoms.[1][2][3][4][5] Low 25(OH)D may contribute to osteomalacic pain and suboptimal response to alendronate; repletion is indicated if deficient.[3][5] Other options are lower yield here: repeat DXA is not necessary for symptom evaluation; EMG/NCS and cervical MRI are not indicated without focal neurologic deficits; ANA is low yield with normal exam and ESR; “no further evaluation” risks missing a common, treatable cause.[6][7][8][9] If deficient, typical repletion regimens (per Endocrine-focused guidance) use cholecalciferol to achieve ≥20–30 ng/mL, with many osteoporosis guidelines targeting ≥30 ng/mL; dosing should be individualized to baseline level and comorbidities.[4][6] This diagnostic algorithm figure highlights incorporation of 25(OH)D testing in the evaluation of postmenopausal osteoporosis and consideration of osteomalacia among alternative diagnoses. Figure 1. Diagnostic Algorithm for the Evaluation of Postmenopausal Osteoporosis. Used under license from The New England Journal of Medicine.";"1. American Association of Clinical Endocrinologists/American College of Endocrinology Clinical Practice Guidelines for the Diagnosis and Treatment of Postmenopausal Osteoporosis-2020 Update. Camacho PM, Petak SM, Binkley N, et al.. Endocrine Practice : Official Journal of the American College of Endocrinology and the American Association of Clinical Endocrinologists. 2020;26(Suppl 1):1-46. doi:10.4158/GL-2020-0524SUPPL. 2. Postmenopausal Osteoporosis. Walker MD, Shane E.. The New England Journal of Medicine. 2023;389(21):1979-1991. doi:10.1056/NEJMcp2307353. 3. Osteoporosis. Morin SN, Leslie WD, Schousboe JT.. JAMA. 2025;:2835762. doi:10.1001/jama.2025.6003. 4. Italian Association of Clinical Endocrinologists (AME) and Italian Chapter of the American Association of Clinical Endocrinologists (AACE) Position Statement: Clinical Management of Vitamin D Deficiency in Adults. Cesareo R, Attanasio R, Caputo M, et al.. Nutrients. 2018;10(5):E546. doi:10.3390/ nu10050546. Copyright License: CC BY 5. Sex-Specific 25-Hydroxyvitamin D Threshold Concentrations for Functional Outcomes in Older Adults: PRoject on Optimal VItamin D in Older Adults (PROVIDO). Shardell M, Cappola AR, Guralnik JM, et al.. The American Journal of Clinical Nutrition. 2021;114(1):16-28. doi:10.1093/ajcn/ nqab025. 6. The Yield of Diagnostic Work-Up of Patients Presenting With Myalgia, Exercise Intolerance, or Fatigue: A Prospective Observational Study. Te Riele MG, Schreuder TH, van Alfen N, et al.. Neuromuscular Disorders : NMD. 2017;27(3):243-250. doi:10.1016/j.nmd.2016.12.002. 7. Muscle Weakness in Adults: Evaluation and Differential Diagnosis. Larson ST, Wilbur J.. American Family Physician. 2020;101(2):95-108. 8. Office Evaluation of the Patient With Musculoskeletal Complaints. Barth WF.. The American Journal of Medicine. 1997;102(1A):3S-10S. doi:10.1016/ s0002-9343(97)00410-5. 9. Electromyography and Muscle Biopsy in Chronic Isolated Myalgia: A Prospective Study. Echaniz-Laguna A, Chanson JB.. Muscle & Nerve. 2016;54(2):321-4. doi:10.1002/mus.25160."
241;Question 45.1 (MC-NJ) - Step 3;"A 22-year-old man comes to the emergency department because of a 4‐day history of cough productive of green sputum as well as fever, chills, and rigors. He also has had a 3‐day history of progressive shortness of breath; he now has shortness of breath at rest. He was evaluated in an urgent care center 1 day ago and was prescribed azithromycin, but his symptoms have worsened. He is using accessory muscles of respiration. He is diaphoretic and is able to give only one- to two-word answers to questions. Vital signs are temperature 39.1°C (102.3°F), pulse 138/min, respirations 40/min, and blood pressure 103/56 mm Hg. Pulse oximetry on room air shows an oxygen saturation of 80%, and 100% oxygen is administered via nonrebreather face mask. Skin is mottled and there is cyanosis of the fingers and toes. Pupils measure 4 mm in diameter and are reactive to light. Mucous membranes are dry. Auscultation of the lungs discloses bilateral crackles. The remainder of the physical examination discloses no abnormalities. Laboratory studies are ordered; results of arterial blood gas analysis on 100% oxygen via nonrebreather face mask are shown: PO2: 50 mm Hg PCO2: 44 mm Hg pH: 7.34 Oxygen saturation: 85% Chest x-ray shows bilateral infiltrates with a normal cardiac silhouette and no effusions. Which of the following is the most likely underlying cause of this patient's condition?";(A) Abnormalities of diffusion of oxygen (B) Hypoventilation (C) Obstructive lung disease (D) Ventilation-perfusion mismatch and shunt ;D;D;https://openevidence.com/usmle-results/step-3-;"Ventilation-perfusion mismatch and shunt (D) The presentation is consistent with severe acute hypoxemic respiratory failure from pneumonia complicated by ARDS: acute onset, bilateral infiltrates with normal cardiac silhouette, profound hypoxemia refractory to 100% O2 (PaO2 50 mm Hg; SaO2 85% on NRB), tachypnea with near-normal PaCO2, and no signs of cardiogenic edema. In ARDS, the predominant mechanisms of hypoxemia are true intrapulmonary shunt (perfused, nonventilated alveoli from alveolar flooding/collapse) and extensive low V/Q regions; these are characteristically poorly responsive to increased FiO2, unlike hypoventilation, obstructive disease, or isolated diffusion limitation.[1][2][3][4][5][6] Key points: • Shunt/low V/Q cause large A–a gradients and refractory hypoxemia; near- normal PaCO2 is common early due to high minute ventilation.[2][3][4] • Breathing 100% O2 often fails to normalize PaO2 in shunt-dominant states and may worsen atelectasis in acute lung injury, further increasing shunt. [5] • Hypoventilation would produce hypercapnia with alveolar hypoxemia that corrects with oxygen; obstructive disease alone would not explain bilateral infiltrates and such severe refractory hypoxemia; pure diffusion limitation rarely causes this degree of hypoxemia at rest and typically improves with high FiO2.[2][3][6][7] Overall, the gas exchange pattern and imaging most strongly indicate shunt- dominant V/Q mismatch as seen in ARDS secondary to severe pneumonia.[1][3] [4][5][6]";"1. Acute Respiratory Distress Syndrome: Diagnosis and Management. Saguil A, Fargo M.. American Family Physician. 2012;85(4):352-8. 2. Gas Exchange in the Respiratory Distress Syndromes. Albert RK, Jobe A.. Comprehensive Physiology. 2012;2(3):1585-617. doi:10.1002/cphy.c090019. 3. Pulmonary Gas Exchange Response to Oxygen Breathing in Acute Lung Injury. Santos C, Ferrer M, Roca J, et al.. American Journal of Respiratory and Critical Care Medicine. 2000;161(1):26-31. doi:10.1164/ ajrccm.161.1.9902084. 4. Gas Exchange and Ventilation-Perfusion Relationships in the Lung. Petersson J, Glenny RW.. The European Respiratory Journal. 2014;44(4):1023-41. doi:10.1183/09031936.00037014. 5. Diagnosis and Management of Acute Respiratory Failure. Lagina M, Valley TS.. Critical Care Clinics. 2024;40(2):235-253. doi:10.1016/j.ccc.2024.01.002. 6. Evaluating Pulmonary Function: An Assessment of PaO2/FIO2. Feiner JR, Weiskopf RB.. Critical Care Medicine. 2017;45(1):e40-e48. doi:10.1097/ CCM.0000000000002017. 7. Gas Exchange in the Lung. Petersson J, Glenny RW.. Seminars in Respiratory and Critical Care Medicine. 2023;44(5):555-568. doi:10.1055/ s-0043-1770060."
